{
  "$schema": "https://json-schema.org/draft/2020-12/schema",
  "$id": "https://pentest-core/schemas/engagement.schema.json",
  "title": "Engagement",
  "description": "Configuration file for a pentest engagement. Source of truth for all skills.",
  "type": "object",
  "required": [
    "engagement_id",
    "client_name",
    "type",
    "dates",
    "scope",
    "roe",
    "testers",
    "remote_hosts",
    "emergency_contacts",
    "output_dir"
  ],
  "additionalProperties": false,
  "properties": {
    "engagement_id": {
      "type": "string",
      "pattern": "^[A-Za-z0-9_-]+$",
      "description": "Unique identifier for the engagement"
    },
    "client_name": {
      "type": "string",
      "description": "Name of the client organization"
    },
    "type": {
      "type": "string",
      "enum": ["external", "internal", "web_app", "red_team", "iot", "mixed"],
      "description": "Type of pentest engagement"
    },
    "dates": {
      "type": "object",
      "required": ["start", "end"],
      "additionalProperties": false,
      "properties": {
        "start": {
          "type": "string",
          "format": "date",
          "description": "Engagement start date (YYYY-MM-DD)"
        },
        "end": {
          "type": "string",
          "format": "date",
          "description": "Engagement end date (YYYY-MM-DD)"
        }
      }
    },
    "scope": {
      "type": "object",
      "required": ["in_scope", "out_of_scope"],
      "additionalProperties": false,
      "properties": {
        "in_scope": {
          "type": "array",
          "description": "Assets and targets that are in scope for testing",
          "items": {
            "type": "object",
            "required": ["type", "value"],
            "additionalProperties": false,
            "properties": {
              "type": {
                "type": "string",
                "enum": ["cidr", "domain", "url", "ip"]
              },
              "value": {
                "type": "string"
              },
              "added_at": {
                "type": "string",
                "format": "date-time",
                "description": "When this target was added to scope"
              }
            }
          }
        },
        "out_of_scope": {
          "type": "array",
          "description": "Assets explicitly excluded from testing",
          "items": {
            "type": "object",
            "required": ["type", "value", "reason"],
            "additionalProperties": false,
            "properties": {
              "type": {
                "type": "string",
                "enum": ["cidr", "domain", "url", "ip"]
              },
              "value": {
                "type": "string"
              },
              "reason": {
                "type": "string",
                "description": "Why this target is excluded from scope"
              },
              "removed_at": {
                "type": "string",
                "format": "date-time",
                "description": "When this target was removed from scope"
              }
            }
          }
        }
      }
    },
    "roe": {
      "type": "object",
      "required": [
        "testing_windows",
        "restricted_techniques",
        "social_engineering_permitted",
        "defense_evasion_permitted"
      ],
      "additionalProperties": false,
      "description": "Rules of Engagement",
      "properties": {
        "testing_windows": {
          "type": "array",
          "description": "Allowed windows for active testing",
          "items": {
            "type": "object",
            "required": ["days", "start", "end", "timezone"],
            "additionalProperties": false,
            "properties": {
              "days": {
                "type": "array",
                "items": {
                  "type": "string",
                  "enum": ["mon", "tue", "wed", "thu", "fri", "sat", "sun"]
                },
                "minItems": 1,
                "uniqueItems": true
              },
              "start": {
                "type": "string",
                "pattern": "^([01][0-9]|2[0-3]):[0-5][0-9]$",
                "description": "Window start time in HH:MM format"
              },
              "end": {
                "type": "string",
                "pattern": "^([01][0-9]|2[0-3]):[0-5][0-9]$",
                "description": "Window end time in HH:MM format"
              },
              "timezone": {
                "type": "string",
                "description": "IANA timezone identifier (e.g. America/New_York)"
              }
            }
          }
        },
        "restricted_techniques": {
          "type": "array",
          "description": "Techniques that must not be used during testing",
          "items": {
            "type": "string"
          }
        },
        "social_engineering_permitted": {
          "type": "boolean",
          "description": "Whether social engineering attacks are permitted"
        },
        "defense_evasion_permitted": {
          "type": "boolean",
          "description": "Whether active defense evasion techniques are permitted"
        },
        "rate_limits": {
          "type": "object",
          "description": "Concurrency and throughput caps used by the orchestration layer.",
          "additionalProperties": false,
          "properties": {
            "requests_per_second_per_target": {
              "type": "integer",
              "minimum": 1,
              "description": "Per-target HTTP/scan request rate ceiling."
            },
            "parallel_workers_per_phase": {
              "type": "integer",
              "minimum": 1,
              "description": "Max concurrent phase-worker subagents in a single batch."
            },
            "parallel_research_workers": {
              "type": "integer",
              "minimum": 1,
              "description": "Max concurrent research subagents at any time."
            },
            "scan_threads": {
              "type": "integer",
              "minimum": 1,
              "description": "Per-tool thread cap (passed as --threads/--max-rate equivalents)."
            },
            "default_phase_deadline_seconds": {
              "type": "integer",
              "minimum": 60,
              "description": "Default per-phase wall-clock deadline before workers are marked timeout."
            },
            "research_worker_deadline_seconds": {
              "type": "integer",
              "minimum": 30,
              "description": "Per-research-worker wall-clock deadline."
            }
          }
        }
      }
    },
    "testers": {
      "type": "array",
      "minItems": 1,
      "description": "Testers assigned to this engagement",
      "items": {
        "type": "object",
        "required": ["handle", "name"],
        "additionalProperties": false,
        "properties": {
          "handle": {
            "type": "string",
            "pattern": "^[a-z0-9_-]+$",
            "description": "Unique handle used to tag findings and actions"
          },
          "name": {
            "type": "string",
            "description": "Full name of the tester"
          }
        }
      }
    },
    "remote_hosts": {
      "type": "object",
      "description": "Remote jump/pivot hosts available during the engagement",
      "additionalProperties": {
        "type": "object",
        "required": ["method", "work_dir"],
        "additionalProperties": false,
        "properties": {
          "method": {
            "type": "string",
            "enum": ["ssh", "ssm"],
            "description": "Connection method"
          },
          "work_dir": {
            "type": "string",
            "description": "Working directory on the remote host"
          },
          "host": {
            "type": "string",
            "description": "SSH hostname or IP (required for method: ssh)"
          },
          "key": {
            "type": "string",
            "description": "Path to SSH private key (optional for method: ssh)"
          },
          "instance_id": {
            "type": "string",
            "description": "AWS SSM instance ID (required for method: ssm)"
          }
        }
      }
    },
    "emergency_contacts": {
      "type": "array",
      "description": "Contacts to reach in case of incident during testing",
      "items": {
        "type": "object",
        "required": ["role", "name"],
        "additionalProperties": false,
        "properties": {
          "role": {
            "type": "string",
            "description": "Contact's role or title"
          },
          "name": {
            "type": "string",
            "description": "Contact's full name"
          },
          "phone": {
            "type": "string",
            "description": "Contact's phone number"
          },
          "email": {
            "type": "string",
            "format": "email",
            "description": "Contact's email address"
          }
        }
      }
    },
    "bloodhound_enterprise": {
      "type": "object",
      "description": "BloodHound Enterprise integration settings (optional)",
      "additionalProperties": false,
      "properties": {
        "api_url": {
          "type": "string",
          "format": "uri",
          "description": "BloodHound Enterprise API base URL"
        },
        "token_env_var": {
          "type": "string",
          "description": "Environment variable name containing the API token"
        }
      }
    },
    "plextrac": {
      "type": "object",
      "description": "PlexTrac reporting platform settings",
      "required": ["export_format"],
      "additionalProperties": false,
      "properties": {
        "export_format": {
          "type": "string",
          "enum": ["json", "csv"],
          "description": "Format used when exporting findings to PlexTrac"
        },
        "api_url": {
          "type": "string",
          "format": "uri",
          "description": "PlexTrac API base URL"
        }
      }
    },
    "custom_templates_dir": {
      "type": "string",
      "description": "Path to a directory containing custom report templates"
    },
    "tool_inventory": {
      "type": "object",
      "description": "Inventory of tools available on each host (host → tool → metadata)",
      "additionalProperties": {
        "type": "object",
        "description": "Tool map for a single host",
        "additionalProperties": {
          "type": "object",
          "description": "Metadata for a single tool",
          "additionalProperties": false,
          "properties": {
            "installed": {
              "type": "boolean"
            },
            "version": {
              "type": "string"
            },
            "path": {
              "type": "string"
            }
          }
        }
      }
    },
    "breach_db_permitted": {
      "type": "boolean",
      "default": false,
      "description": "Whether querying breach databases (e.g. HaveIBeenPwned) is permitted"
    },
    "output_dir": {
      "type": "string",
      "description": "Directory where all skill output artifacts are written"
    },
    "current_phase": {
      "type": ["string", "null"],
      "description": "Phase name currently being executed by the conductor (null when no phase is active). Read by the orchestration block hook to decide which tools are allowed."
    },
    "last_supervised_at": {
      "type": ["string", "null"],
      "format": "date-time",
      "description": "ISO 8601 UTC timestamp of the last supervisor verdict. Used by the supervisor to compute the activity-log diff window."
    },
    "status": {
      "type": "string",
      "enum": ["setup", "running", "halted", "complete"],
      "description": "Engagement lifecycle state managed by the conductor."
    }
  }
}
